{
  "schemaVersion": "useful.agent-profile.v1",
  "profileId": "default",
  "name": "默认 Agent 配置",
  "actions": [
    {
      "actionId": "builtin.utilities.base64",
      "expectedContractVersion": "1.0",
      "expectedActionVersion": "1.0.0",
      "expectedSourceKind": "builtin",
      "expectedPublisherId": "useful.project",
      "enabled": { "cli": true, "mcp": true },
      "aliases": ["b64-encode"],
      "presets": [
        { "presetId": "encode", "name": "UTF-8 编码", "defaults": { "operation": "encode" } }
      ]
    }
  ]
}
